{
  "$schema": "https://json-schema.org/draft/2020-12/schema",
  "$id": "https://homelab.local/schemas/payloads/polar/polar.acc.v1.schema.json",
  "title": "polar.acc v1",
  "type": "object",
  "additionalProperties": false,
  "required": [
    "samples"
  ],
  "properties": {
    "sample_rate_hz": {
      "type": "number",
      "exclusiveMinimum": 0
    },
    "range_mg": {
      "type": "integer",
      "exclusiveMinimum": 0
    },
    "stream_settings": {
      "type": "object",
      "additionalProperties": true
    },
    "units": {
      "type": "object",
      "additionalProperties": false,
      "required": [
        "x_mg",
        "y_mg",
        "z_mg",
        "device_time_ns"
      ],
      "properties": {
        "x_mg": {
          "type": "string"
        },
        "y_mg": {
          "type": "string"
        },
        "z_mg": {
          "type": "string"
        },
        "device_time_ns": {
          "type": "string"
        }
      }
    },
    "samples": {
      "type": "array",
      "minItems": 1,
      "items": {
        "type": "object",
        "additionalProperties": false,
        "required": [
          "device_time_ns",
          "received_at_collector",
          "x_mg",
          "y_mg",
          "z_mg"
        ],
        "properties": {
          "device_time_ns": {
            "type": "integer",
            "minimum": 0
          },
          "received_at_collector": {
            "type": "string",
            "format": "date-time"
          },
          "x_mg": {
            "type": "number"
          },
          "y_mg": {
            "type": "number"
          },
          "z_mg": {
            "type": "number"
          }
        }
      }
    }
  }
}
