{
  "sample_rate_hz": 200,
  "range_mg": 8,
  "stream_settings": {
    "sdk_mode": "online_live",
    "selected": {
      "sampleRate": 200,
      "range": 8,
      "resolution": 16,
      "channels": 3
    },
    "available": {
      "sampleRate": [
        200
      ],
      "range": [
        8
      ],
      "resolution": [
        16
      ],
      "channels": [
        3
      ]
    }
  },
  "units": {
    "x_mg": "mg",
    "y_mg": "mg",
    "z_mg": "mg",
    "device_time_ns": "ns_since_2000_epoch"
  },
  "samples": [
    {
      "device_time_ns": 831889595000000000,
      "received_at_collector": "2026-04-26T12:30:10.221Z",
      "x_mg": 10,
      "y_mg": -3,
      "z_mg": 1005
    },
    {
      "device_time_ns": 831889595005000000,
      "received_at_collector": "2026-04-26T12:30:10.226Z",
      "x_mg": 12,
      "y_mg": -2,
      "z_mg": 1001
    }
  ]
}
